{"run":5,"commit":"f4f41ec","metric":29773,"metrics":{"system_prompt_total_chars":30933},"status":"keep","description":"Frequency-based dynamic tail ordering: deployConfig(yearly)→toolManifest(rarely)→modelAliases(quarterly)→skills(monthly)→workspaceNotes(weekly)→MEMORY.md(daily). Primary metric drops 100%→96.2% but RESTORES skills 91.2%→99.6% and workspaceNotes 91.5%→100.0%. Total expected cache savings much higher (skills 12x/year, wsNotes 52x/year vs toolNames 2x/year). 53 tests pass.","timestamp":1773399354033,"segment":1}
{"run":6,"commit":"1f57bac","metric":29773,"metrics":{"system_prompt_total_chars":30933},"status":"keep","description":"Converged: 96.2% stable for toolNames scenario. Updated autoresearch.md and ideas.md with full picture. Combined frequency-weighted ordering gives optimal production KV cache. 53 tests pass.","timestamp":1773399493957,"segment":1}
{"type":"config","name":"OpenClaw KV Cache — per-conversation scenario (group chat / channel switch)","metricName":"system_prompt_stable_chars","metricUnit":"","bestDirection":"higher"}
{"run":1,"commit":"a8d35fc","metric":27262,"metrics":{"system_prompt_total_chars":30933,"toolNames_stable_chars":29773},"status":"keep","description":"Baseline: per-conversation scenario. deployConfig is after GroupChat/Reasoning in dynamic tail. Per-conversation stable = 27262 (88.1%). Secondary: toolNames stable = 29773 (96.2%). New benchmark measures first-diff when group chat context changes.","timestamp":1773400360639,"segment":1}
{"run":2,"commit":"ae8d4ee","metric":27581,"metrics":{"system_prompt_total_chars":30933,"toolNames_stable_chars":29773},"status":"keep","description":"Move Reactions+Reasoning Format BEFORE GroupChat. Both are stable per-channel/session, not per-conversation. Per-conversation: 27262→27581 (+319, 88.1%→89.2%). toolNames unchanged at 29773.","timestamp":1773400570811,"segment":1}
{"run":3,"commit":"038f28f","metric":29574,"metrics":{"system_prompt_total_chars":30933,"toolNames_stable_chars":29574},"status":"keep","description":"Move Tool Manifest BEFORE GroupChat. Plugins change rarely vs per-conv every session. +1993 chars to per-conv stable prefix (89.2%→95.6%). toolNames regression: -199 chars (29773→29574). Net: massive win.","timestamp":1773400816194,"segment":1}
{"run":4,"commit":"d9bf005","metric":30735,"metrics":{"system_prompt_total_chars":30933,"toolNames_stable_chars":29574},"status":"keep","description":"Move GroupChat to ABSOLUTELY LAST (after MEMORY.md). Per-conv is most frequent event — the entire prompt is now cached on every conversation switch. 29574→30735 (+1161, 95.6%→99.4%). toolNames secondary metric unchanged at 29574.","timestamp":1773400995474,"segment":1}
{"run":5,"commit":"d9bf005","metric":30735,"metrics":{"system_prompt_total_chars":30933,"toolNames_stable_chars":28763},"status":"discard","description":"Move deployConfig from before channel= to after Tool Manifest. Per-conv unchanged (still 99.4% theoretical max). Secondary gain: deployConfig 87%→95.4%, cost: toolNames 97%→95.1%. Good for overall system but doesn't move primary metric.","timestamp":1773401287347,"segment":1}
{"run":6,"commit":"fab5760","metric":30735,"metrics":{"system_prompt_total_chars":30933,"toolNames_stable_chars":28763},"status":"keep","description":"Converged: per-conv 99.4% (30735/30933 = theoretical max). deployConfig structural win: moved after TM (87%→95.4%) at cost of toolNames -1.9%. Secondary improvements: Reactions+Reasoning+TM before GroupChat, GroupChat absolutely last. 53 tests pass.","timestamp":1773401404834,"segment":1}
{"run":7,"commit":"eba9994","metric":30735,"metrics":{"system_prompt_total_chars":30933,"toolNames_stable_chars":28763},"status":"keep","description":"CONVERGED. Per-conv 99.4% = theoretical max. Updated autoresearch.md + ideas.md with complete picture. All scenarios: per-conv 99.4%, MEMORY.md 99.5%, skills 99.5%, wsNotes 99.6%, modelAliases 97.4%, toolNames 95.1%, deployConfig 95.4%. 53 tests pass.","timestamp":1773401557874,"segment":1}
