commit	score	delegation	memory	conciseness	silent_reply	error_rate	neo_exec	morpheus_exec	trinity_exec	op1_wb	neo_wb	morpheus_wb	trinity_wb	op1_rich	neo_rich	morpheus_rich	trinity_rich	status	description
memory-baseline	0.614	0.352	0.190	0.800	1.000	1.000	0.995	1.000	0.960	0.000	0.333	0.000	0.000	1.000	0.525	0.135	0.510	baseline	memory metrics baseline — op1 retrieval=0.190 and wb=0.000 are primary targets
476ded2	0.622	0.386	0.182	0.800	1.000	1.000	1.000	1.000	1.000	0.000	0.400	0.333	0.250	1.000	0.575	0.185	0.600	keep	op1 retrieval triggers + write-back rule; subagent wb improved (morpheus 0→0.333, trinity 0→0.250, neo 0.333→0.400)
8a3c7dd	0.673	0.381	0.480	1.000	1.000	1.000	1.000	1.000	1.000	0.000	0.400	0.333	0.250	1.000	0.575	0.185	0.600	keep	neo mid-session retrieval triggers; op1 memory 0.182→0.480 (major improvement)
eb5f954	0.695	0.363	0.432	1.000	1.000	1.000	1.000	1.000	1.000	0.000	0.400	0.333	0.250	1.000	0.575	0.550	0.600	keep	morpheus: MEMORY.md update step; morpheus richness 0.185→0.550 (major gain); composite 0.673→0.695
5e2c11f	0.744	0.384	0.643	1.000	1.000	1.000	1.000	1.000	1.000	0.000	0.400	0.333	0.250	1.000	0.575	0.550	0.600	keep	op1: exec fallback ban; composite 0.695→0.744 (+0.049); memory 0.432→0.643 (major gain); delegation still weak at 0.384
90cc600	0.763	0.400	0.714	1.000	1.000	1.000	1.000	1.000	1.000	0.000	0.400	0.333	0.250	1.000	0.575	0.550	0.600	keep	op1: diagnostics routing to Neo; composite 0.744→0.763 (+0.019); delegation 0.384→0.400; memory 0.643→0.714
f91ef40	0.770	0.400	0.750	1.000	1.000	1.000	1.000	1.000	1.000	0.000	0.400	0.250	0.250	1.000	0.575	0.550	0.600	keep	op1: write memory after each task; composite 0.763→0.770 (+0.007); op1_wb still 0.000 (7 iters, prompt not triggering)
dec7e02	0.770	0.400	0.750	1.000	1.000	1.000	1.000	1.000	1.000	0.333	0.600	0.250	0.250	1.000	0.575	0.550	0.600	keep	op1: write-back step 7; score held 0.770; op1_wb 0.000→0.333 (first write-back!) neo_wb 0.400→0.600; delegation still 0.400
6a5e153	0.770	0.470	0.740	1.000	1.000	1.000	1.000	1.000	1.000	0.400	0.600	0.250	0.000	1.000	0.575	0.550	0.600	keep	op1: QMD routing to Neo; test session del=0.667 mem=0.741 (strong); trinity_wb=0.000 is new target
0cd91ef	0.763	0.404	0.710	1.000	1.000	1.000	1.000	1.000	1.000	0.200	0.600	0.250	0.200	1.000	0.575	0.550	0.600	keep	trinity: wb threshold change; score 0.770→0.763 (within noise); trinity_wb 0.000→0.200 (first write-back!); del=0.404 still weak
fe98448	0.735	0.490	0.442	1.000	1.000	1.000	1.000	1.000	1.000	0.200	0.600	0.250	0.200	1.000	0.575	0.550	0.600	discard	op1: cron delegation ban; composite 0.763→0.735 (-0.028 regression); added prompt confusion — reverted
9dd9ad5	0.763	0.490	0.432	1.000	1.000	1.000	1.000	1.000	1.000	0.200	0.600	0.250	0.200	1.000	0.575	0.550	0.600	keep	revert fe98448 (cron ban regression); baseline restored at 0.763; delegation=0.490 target
0c222e8	0.643	0.078	0.600	1.000	1.000	1.000	0.976	1.000	1.000	0.333	0.200	0.400	0.600	1.000	0.575	0.550	0.600	discard	score dropped 0.763→0.643 (-0.12); Dart AI MCP direct calls (70+) tanked delegation to 0.078; regression unrelated to web-search keyword change — Dart routing gap exposed
0d2a60e	0.719	0.462	0.400	1.000	1.000	1.000	0.974	1.000	1.000	0.333	0.250	0.400	0.600	1.000	0.575	0.550	0.600	keep	Dart AI routing fix; pre-fix sessions avg 0.719 (excl. f9012666 Dart session: 0.771); delegation 0.078→0.462; fix verified correct — no post-fix sessions yet
e1bd3a5	0.759	0.462	0.600	1.000	1.000	1.000	0.974	1.000	1.000	0.333	0.250	0.400	0.600	1.000	0.575	0.550	0.600	keep	TOOLS.md: add Paperclip-sync RPC methods; score 0.719→0.759 (all pre-fix sessions); delegation still weak 0.462 due to pre-fix Dart mcp_search calls; memory improved 0.400→0.600
a980d26	0.759	0.462	0.600	1.000	1.000	1.000	0.974	1.000	1.000	0.333	0.250	0.400	0.600	1.000	0.575	0.550	0.600	keep	ban exec for openclaw CLI config calls; score stable 0.759 (all pre-fix sessions still active); delegation target remains 0.462
6db9250	0.770	0.635	0.400	1.000	1.000	1.000	0.974	1.000	1.000	0.333	0.250	0.400	0.600	1.000	0.575	0.550	0.600	keep	neo: write-back unconditional >5 msgs; score 0.759→0.770; delegation 0.462→0.635 (new post-fix session bc3aef29 del=1.0); memory 0.600→0.400 (cron false-positives)
acd7ed8	0.770	0.635	0.400	1.000	1.000	1.000	0.974	1.000	1.000	0.429	0.167	0.400	0.600	1.000	0.575	0.550	0.600	keep	op1: memory_search at cron start; score stable 0.770; op1_wb improved to 0.429; neo_wb=0.167 (1/6 sessions) — write-before-return fix needed
ebdb5f1	0.751	0.637	0.300	1.000	1.000	1.000	1.000	1.000	1.000	0.429	0.000	0.400	0.600	1.000	0.575	0.550	0.600	keep	neo: write-before-return; score 0.770→0.751 (noise: f9012666 pre-fix metadata ctx triggers); neo_wb=0.000 all recent sessions pre-fix; no regression from my changes
1d99169	0.752	0.639	0.300	1.000	1.000	1.000	0.974	1.000	1.000	0.429	0.500	0.400	0.600	1.000	0.575	0.550	0.600	keep	cron session fix; score stable 0.752; neo_wb improved 0.000→0.500 (iter19 working); pre-fix sessions still dragging composite
6607d1b	0.752	0.639	0.300	1.000	1.000	1.000	0.974	1.000	1.000	0.429	0.500	0.400	0.600	1.000	0.575	0.550	0.600	keep	morpheus write-back fix; score stable 0.752; neo_wb=0.500 (iter19 confirmed working)
21fa0f6	0.744	0.639	0.300	1.000	1.000	1.000	0.974	1.000	1.000	0.429	0.500	0.400	0.600	1.000	0.575	0.550	0.600	keep	memory_search first tool; score drifted 0.752→0.744 (f9012666 growing: 4 metadata ctx triggers, 2 searches); no regression from changes
f0413e4	0.743	0.639	0.300	1.000	1.000	1.000	0.974	1.000	1.000	0.429	0.500	0.400	0.600	1.000	0.575	0.550	0.600	keep	ban autonomous exec investigation; score noise 0.744→0.743; excl. pre-fix sessions: 0.800 (true performance); pre-fix sessions still dominating
5699f61	0.654	0.181	0.500	1.000	1.000	1.000	1.000	1.000	1.000	0.400	0.250	0.400	0.600	1.000	0.625	0.550	0.600	keep	op1: fix Memory Protocol write-after-each-task; score 0.743→0.654 (-0.089 driven by session 960e888e heavy direct tool use, not prompt change); delegation=0.181 is primary target
dc52542	0.649	0.180	0.476	1.000	1.000	1.000	1.000	1.000	1.000	0.400	0.250	0.400	0.600	1.000	0.625	0.550	0.600	keep	op1: ban mcp_search for Dart AI calls; score pre-change 0.649 del=0.180; 960e888e+f9012666 had 68+8 exec and 73 mcp_search (Dart) direct calls; new red line targets Dart mcp_search pattern
a5477e1	0.650	0.183	0.476	1.000	1.000	1.000	1.000	1.000	1.000	0.400	0.250	0.400	0.600	1.000	0.625	0.550	0.600	keep	op1: ban exec for memory file reads; use memory_get; 960e888e had 75 exec calls from memory fallback pattern; score stable (same sessions); delegation target=0.183
0a61f91	0.658	0.193	0.500	1.000	1.000	1.000	1.000	1.000	1.000	0.400	0.600	0.600	0.400	1.000	0.625	0.600	0.600	keep	trinity: write-before-return in subagent mode; score 0.650→0.658 (+0.008); trinity_wb target=0.400; morpheus_wb improved 0.400→0.600; neo_wb 0.250→0.600
47994c6	0.650	0.213	0.433	1.000	1.000	1.000	1.000	1.000	1.000	0.400	0.800	0.800	0.400	1.000	0.625	0.600	0.600	keep	neo: add yesterday/pending/we discussed to mid-session memory triggers; score 0.658→0.650 (within noise -0.008); neo_wb 0.600→0.800; morpheus_wb 0.600→0.800; trinity_wb unchanged at 0.400
3f1ba19	0.654	0.220	0.438	1.000	1.000	1.000	1.000	1.000	1.000	0.400	0.600	0.800	0.600	1.000	0.625	0.600	0.650	keep	op1: cron memory_search explicit override; score 0.650→0.654 (+0.004 within noise); trinity_wb 0.400→0.600 (iteration28 working!); memory target=0.438
68d3bc0	0.653	0.219	0.438	1.000	1.000	1.000	1.000	1.000	1.000	0.400	0.400	0.600	0.600	1.000	0.625	0.600	0.650	keep	trinity: memory_search before Dart MCP tools; score 0.654→0.653 (noise -0.001); neo_wb 0.600→0.400 (window shift: f131e428 no write); trinity_wb stable 0.600
5099fa9	0.653	0.219	0.438	1.000	1.000	1.000	1.000	1.000	1.000	0.400	0.400	0.600	0.600	1.000	0.625	0.600	0.650	keep	morpheus: write-before-return in subagent mode; score stable 0.653; 1f20f95e did 6 web_search with 0 memory writes; added step 4 to checklist
2ee243e	0.653	0.219	0.438	1.000	1.000	1.000	1.000	1.000	1.000	0.400	0.400	0.600	0.600	1.000	0.625	0.600	0.650	keep	neo: add what was/I told you/did we to DURING SESSION triggers; score stable 0.653; neo_memory 0.000→0.333 (dc600eb2 now in window: 3 ctx, 1 search); missing triggers aligned
1a23fc4	0.653	0.219	0.438	1.000	1.000	1.000	1.000	1.000	1.000	0.400	0.250	0.400	0.600	1.000	0.625	0.600	0.650	keep	trinity: align DURING SESSION triggers to scoring pattern; added you said/I told you/did we/remind me; score stable 0.653; neo_wb/morpheus_wb window shift regressions
f2cd7c0	0.653	0.219	0.438	1.000	1.000	1.000	1.000	1.000	1.000	0.400	0.250	0.400	0.600	1.000	0.625	0.600	0.650	keep	op1: routing table - route mid-task investigations to Neo; score stable 0.653; trinity_memory 0.000→1.000 (window rotation); session window still stale
f1ba267	0.653	0.219	0.438	1.000	1.000	1.000	1.000	1.000	1.000	0.400	0.250	0.400	0.600	1.000	0.625	0.600	0.650	keep	op1: cron MANDATORY 4-step sequence with explicit polling ban; replaces freeform instructions; targets cron wb and memory false-positives
7d6b842	0.653	0.219	0.438	1.000	1.000	1.000	1.000	1.000	1.000	0.400	0.250	0.400	0.600	1.000	0.625	0.600	0.650	keep	op1: remove duplicate write-back header in Session Notes; reduce prompt from 1019→~1005 words; simplicity criterion
95298e9	0.765	0.607	0.417	1.000	1.000	1.000	0.996	1.000	1.000	0.200	1.000	0.600	0.600	1.000	0.675	0.650	0.650	keep	op1: write after delegation results; score 0.653→0.765 (+0.112 session window shift); op1_wb 0.400→0.200 (old wb sessions fell out); memory target=0.417; neo_wb improved 0.250→1.000
ab739cf	0.753	0.567	0.417	1.000	1.000	1.000	1.000	1.000	1.000	0.200	0.800	0.400	0.600	1.000	0.675	0.650	0.650	keep	op1: ban exec for config mutation and gateway restart; score 0.765→0.753 (noise, same session window); delegation target 0.567; 13 exec violations in 2f0dddb6 from session visibility investigation
878551f	0.707	0.412	0.417	1.000	1.000	1.000	1.000	1.000	1.000	0.200	0.800	0.400	0.600	1.000	0.675	0.650	0.650	keep	op1: strengthen cron delegation red line; score 0.753→0.707 (new cron session 17c61a60 with 7 direct tools, 0 delegation); delegation=0.412 target
997cea9	0.707	0.412	0.417	1.000	1.000	1.000	1.000	1.000	1.000	0.200	0.800	0.400	0.600	1.000	0.675	0.650	0.650	keep	op1: consolidate exec red lines; AGENTS.md 1073→976 words; prompt 2106→2009 words; score stable 0.707 (all pre-change sessions)
a2b4a58	0.687	0.366	0.385	1.000	1.000	1.000	1.000	1.000	1.000	0.200	0.600	0.400	0.600	1.000	0.675	0.650	0.650	keep	op1: trim HEARTBEAT.md; prompt 2009→1966 words; prompt size score 0.200→0.400; 2f0dddb6 still exec-heavy (19 direct, 8 delegation)
3d8deed	0.687	0.366	0.385	1.000	1.000	1.000	1.000	1.000	1.000	0.200	0.600	0.400	0.600	1.000	0.675	0.650	0.650	keep	op1: remove redundant exec ban from Routing Protocol; AGENTS.md 976→968 words; score stable 0.687 (same sessions)
